{"aggregate_id":"10000000-0000-4000-8000-000000000001","aggregate_kind":"subscription_cycle","builder_id":"00000000-0000-4000-8000-000000000001","catalog_version_id":"payment-2026-10-03","credit_grant_mc":5000,"currency":"BRL","event_id":"20000000-0000-4000-8000-000000000002","event_type":"subscription.cycle_reversed.v1","financial_revision":2,"lines":[{"credit_grant_mc":0,"financial_state":"reversed","kind":"additional_clinic","line_amount_cents":20000,"line_id":"additional_clinic","offer_id":"plan_plus_monthly_v1","quantity":1,"restored_cents":0,"reversed_cents":20000,"settled_cents":20000,"unit_amount_cents":20000},{"credit_grant_mc":5000,"financial_state":"settled","kind":"plan","line_amount_cents":99900,"line_id":"plan","offer_id":"plan_plus_monthly_v1","quantity":1,"restored_cents":0,"reversed_cents":0,"settled_cents":99900,"unit_amount_cents":99900}],"occurred_at":"2026-10-13T12:00:00Z","offer_id":"plan_plus_monthly_v1","payment_id":"pay_subscription_fixture","producer":"asaas-payment-gateway","produced_at":"2026-10-13T12:00:01Z","restored_cents":0,"reversed_cents":20000,"schema_version":"billing.fact.v1","settled_cents":119900,"subscription_cycle":{"cycle_end":"2026-11-12","cycle_start":"2026-10-12"},"total_amount_cents":119900}
